{
  "capabilities": {
    "operations": [
      {
        "description": "code_generation operation",
        "name": "code_generation"
      },
      {
        "description": "scaffolding operation",
        "name": "scaffolding"
      },
      {
        "description": "automation operation",
        "name": "automation"
      }
    ]
  },
  "governance": {
    "compliance_level": 2,
    "constitution_hash": "df4bf7b77c3676432442e3fa21fe392389dd43f57527feded615131856347309",
    "issued_at": "2025-11-29T08:57:39.452796Z",
    "issuer": "passport_office"
  },
  "identity": {
    "agent_id": "engineer",
    "name": "ENGINEER"
  },
  "specs": {
    "description": "Meta-agent for building new agents and code",
    "domain": "INFRASTRUCTURE",
    "version": "1.0.0"
  }
}
