{
  "identity": {
    "agent_id": "echo",
    "name": "ECHO"
  },
  "specs": {
    "version": "1.0.0",
    "description": "Test agent: echoes messages with timestamp",
    "domain": "TESTING"
  },
  "capabilities": {
    "operations": [
      {
        "name": "echo_back",
        "description": "Echo a message back with timestamp"
      }
    ]
  },
  "governance": {
    "compliance_level": 1,
    "constitution_hash": "df4bf7b77c3676432442e3fa21fe392389dd43f57527feded615131856347309",
    "issued_at": "2025-12-02T00:00:00.000000Z",
    "issuer": "passport_office"
  }
}
