{
  "capabilities": {
    "operations": [
      {
        "description": "Tool for watchman_104151_6c8f",
        "name": "watchman_104151_6c8f.main_tool"
      }
    ]
  },
  "governance": {
    "compliance_level": 1,
    "constitution_hash": "WILL_BE_COMPUTED_AT_BOOT",
    "issued_at": "WILL_BE_SET_AT_REGISTRATION",
    "issuer": "passport_office"
  },
  "identity": {
    "agent_id": "watchman_104151_6c8f",
    "name": "WATCHMAN"
  },
  "specs": {
    "description": "watches system health",
    "domain": "SPAWNED",
    "version": "1.0.0"
  }
}
