{
  "capabilities": {
    "operations": [
      {
        "description": "discovery operation",
        "name": "discovery"
      },
      {
        "description": "registration operation",
        "name": "registration"
      },
      {
        "description": "governance operation",
        "name": "governance"
      }
    ]
  },
  "governance": {
    "compliance_level": 2,
    "constitution_hash": "df4bf7b77c3676432442e3fa21fe392389dd43f57527feded615131856347309",
    "issued_at": "2025-11-29T08:57:39.441204Z",
    "issuer": "passport_office"
  },
  "identity": {
    "agent_id": "discoverer",
    "name": "DISCOVERER"
  },
  "specs": {
    "description": "Agent discovery, verification, and registration",
    "domain": "GOVERNANCE",
    "version": "1.0.0"
  }
}
