{
  "capabilities": {
    "operations": [
      {
        "description": "monitoring operation",
        "name": "monitoring"
      },
      {
        "description": "alerting operation",
        "name": "alerting"
      }
    ]
  },
  "governance": {
    "compliance_level": 2,
    "constitution_hash": "df4bf7b77c3676432442e3fa21fe392389dd43f57527feded615131856347309",
    "issued_at": "2025-11-29T08:57:39.541003Z",
    "issuer": "passport_office"
  },
  "identity": {
    "agent_id": "watchman",
    "name": "WATCHMAN"
  },
  "specs": {
    "description": "System integrity and monitoring agent",
    "domain": "SYSTEM",
    "version": "1.0.0"
  }
}
