{
  "capabilities": {
    "operations": [
      {
        "description": "governance operation",
        "name": "governance"
      },
      {
        "description": "voting operation",
        "name": "voting"
      },
      {
        "description": "proposal_management operation",
        "name": "proposal_management"
      }
    ]
  },
  "governance": {
    "compliance_level": 2,
    "constitution_hash": "df4bf7b77c3676432442e3fa21fe392389dd43f57527feded615131856347309",
    "issued_at": "2025-11-29T08:57:39.474530Z",
    "issuer": "passport_office"
  },
  "identity": {
    "agent_id": "forum",
    "name": "FORUM"
  },
  "specs": {
    "description": "Democratic decision layer for governance",
    "domain": "COMMUNITY",
    "version": "1.0.0"
  }
}
