{
  "capabilities": {
    "operations": [
      {
        "description": "offerings operation",
        "name": "offerings"
      }
    ]
  },
  "governance": {
    "compliance_level": 2,
    "constitution_hash": "df4bf7b77c3676432442e3fa21fe392389dd43f57527feded615131856347309",
    "issued_at": "2025-11-29T08:57:39.386821Z",
    "issuer": "passport_office"
  },
  "identity": {
    "agent_id": "temple",
    "name": "TEMPLE"
  },
  "specs": {
    "description": "Spiritual guidance and offerings",
    "domain": "SPIRITUAL",
    "version": "1.0.0"
  }
}
