{
  "capabilities": {
    "operations": [
      {
        "description": "registry operation",
        "name": "registry"
      },
      {
        "description": "licensing operation",
        "name": "licensing"
      },
      {
        "description": "ledger operation",
        "name": "ledger"
      },
      {
        "description": "governance operation",
        "name": "governance"
      }
    ]
  },
  "governance": {
    "compliance_level": 2,
    "constitution_hash": "df4bf7b77c3676432442e3fa21fe392389dd43f57527feded615131856347309",
    "issued_at": "2025-11-28T11:15:45.898796Z",
    "issuer": "passport_office"
  },
  "identity": {
    "agent_id": "civic",
    "name": "CIVIC"
  },
  "specs": {
    "description": "Core governance and registry management",
    "domain": "GOVERNANCE",
    "version": "2.0.0"
  }
}